download_url,T2,λ2,author_year,comments,λ1,name,doi,formula,T1,fname
https://uv-vis-spectral-atlas-mainz.org//uvvis_data/cross_sections/Halogeno-alkanes+radicals/Fluoroalkanes/CH2F2(HFC-32)_JPL-2015(2015)_298K_121.567nm(rec).txt,NaN,NaN,JPL-2015(2015),The recommended absorption cross section at the Lyman-α wavelength with an estimated uncertainty factor p(298 K) = 1.4  is the same as given in the evaluation of,121.567,difluoromethane,,CH2F2(HFC-32),298.0,data/cross-sections/Halogeno-alkanes+radicals/Fluoroalkanes/CH2F2(HFC-32)/CH2F2(HFC-32)_JPL-2015(2015)_298K_121.csv
https://uv-vis-spectral-atlas-mainz.org//uvvis_data/cross_sections/Halogeno-alkanes+radicals/Fluoroalkanes/CH2F2(HFC-32)_Sauvageau(1973)_298K_105-142nm.txt,NaN,142.0,Sauvageau(1973),Absorption measurements using the helium (Hopfield) continuum for the 65-106-nm region and a hydrogen discharge tube for the 106-140-nm region as light sources and a vacuum spectrophotometer under 0.02 nm resolution,105.0,difluoromethane, https://doi.org/10.1063/1.1680086,CH2F2(HFC-32),298.0,data/cross-sections/Halogeno-alkanes+radicals/Fluoroalkanes/CH2F2(HFC-32)/CH2F2(HFC-32)_Sauvageau(1973)_298K_105-142nm.csv
https://uv-vis-spectral-atlas-mainz.org//uvvis_data/cross_sections/Halogeno-alkanes+radicals/Fluoroalkanes/CH2F2(HFC-32)_Sauvageau(1973)_298K_60-105nm.txt,NaN,105.0,Sauvageau(1973),Absorption measurements using the helium (Hopfield) continuum for the 65-106-nm region and a hydrogen discharge tube for the 106-140-nm region as light sources and a vacuum spectrophotometer under 0.02 nm resolution,60.0,difluoromethane, https://doi.org/10.1063/1.1680086,CH2F2(HFC-32),298.0,data/cross-sections/Halogeno-alkanes+radicals/Fluoroalkanes/CH2F2(HFC-32)/CH2F2(HFC-32)_Sauvageau(1973)_298K_60-105nm.csv
https://uv-vis-spectral-atlas-mainz.org//uvvis_data/cross_sections/Halogeno-alkanes+radicals/Fluoroalkanes/CH2F2(HFC-32)_Seccombe(2001)_298K_60-120nm.txt,NaN,120.0,Seccombe(2001),Absorption measurements using synchrotron radiation,60.0,difluoromethane, https://doi.org/10.1063/1.1344888,CH2F2(HFC-32),298.0,data/cross-sections/Halogeno-alkanes+radicals/Fluoroalkanes/CH2F2(HFC-32)/CH2F2(HFC-32)_Seccombe(2001)_298K_60-120nm.csv
https://uv-vis-spectral-atlas-mainz.org//uvvis_data/cross_sections/Halogeno-alkanes+radicals/Fluoroalkanes/CH2F2(HFC-32)_Seccombe(2001)_298K_96.4-150nm.txt,NaN,150.0,Seccombe(2001),Absorption measurements using synchrotron radiation,96.4,difluoromethane, https://doi.org/10.1063/1.1344888,CH2F2(HFC-32),298.0,data/cross-sections/Halogeno-alkanes+radicals/Fluoroalkanes/CH2F2(HFC-32)/CH2F2(HFC-32)_Seccombe(2001)_298K_96.csv
https://uv-vis-spectral-atlas-mainz.org//uvvis_data/cross_sections/Halogeno-alkanes+radicals/Fluoroalkanes/CH2F2(HFC-32)_SPARC(2013)_298K_121.567nm(rec).txt,NaN,NaN,SPARC(2013),Recommended absorption cross section at the Lyman-α wavelength with an estimated uncertainty factor p(298 K) = 1.4,121.567,difluoromethane,,CH2F2(HFC-32),298.0,data/cross-sections/Halogeno-alkanes+radicals/Fluoroalkanes/CH2F2(HFC-32)/CH2F2(HFC-32)_SPARC(2013)_298K_121.csv
