download_url,T2,λ2,author_year,comments,λ1,name,doi,formula,T1,fname
https://uv-vis-spectral-atlas-mainz.org//uvvis_data/cross_sections/Organics%20(N-compounds)/Amines/C2H5NH2_Hubin-Franskin(2002)_298K_137-241nm.txt,NaN,241.0,Hubin-Franskin(2002),High-resolution (0.05 nm) UV-VUV photon absorption spectrum recorded at 5.0-9.0 eV using synchrotron radiation,137.0,ethylamine, https://doi.org/10.1063/1.1473820,C2H5NH2,298.0,data/cross-sections/Organics (N-compounds)/Amines/C2H5NH2/C2H5NH2_Hubin-Franskin(2002)_298K_137-241nm.csv
https://uv-vis-spectral-atlas-mainz.org//uvvis_data/cross_sections/Organics%20(N-compounds)/Amines/C2H5NH2_Hubin-Franskin(2002)_298K_86-258nm.txt,NaN,258.0,Hubin-Franskin(2002),Electron energy loss spectrum (EELS) recorded at 150 eV; energy loss energy converted to wavelengths,86.0,ethylamine, https://doi.org/10.1063/1.1473820,C2H5NH2,298.0,data/cross-sections/Organics (N-compounds)/Amines/C2H5NH2/C2H5NH2_Hubin-Franskin(2002)_298K_86-258nm.csv
https://uv-vis-spectral-atlas-mainz.org//uvvis_data/cross_sections/Organics%20(N-compounds)/Amines/C2H5NH2_Meller(1999)_298K_188-262nm.txt,NaN,262.0,Meller(1999),High-resolution (0.08 nm) absorption cross sections have been obtained by personal communication from Richard Meller (1999),188.0,ethylamine,,C2H5NH2,298.0,data/cross-sections/Organics (N-compounds)/Amines/C2H5NH2/C2H5NH2_Meller(1999)_298K_188-262nm.csv
https://uv-vis-spectral-atlas-mainz.org//uvvis_data/cross_sections/Organics%20(N-compounds)/Amines/C2H5NH2_Tannenbaum(1953)_298K_160.1-255.4nm.txt,NaN,255.4,Tannenbaum(1953),Absorption measurements by photographic spectrophotometry using flowing and static vapors and hydrogen lamps as light sources,160.1,ethylamine, https://doi.org/10.1063/1.1698878,C2H5NH2,298.0,data/cross-sections/Organics (N-compounds)/Amines/C2H5NH2/C2H5NH2_Tannenbaum(1953)_298K_160.csv
"https://uv-vis-spectral-atlas-mainz.org//uvvis_data/cross_sections/Organics%20(N-compounds)/Amines/C2H5NH2_Tannenbaum(1953)_298K_177,213nm(max).txt",NaN,213.0,Tannenbaum(1953),Absorption measurements by photographic spectrophotometry using flowing and static vapors and hydrogen lamps as light sources,177.0,ethylamine, https://doi.org/10.1063/1.1698878,C2H5NH2,298.0,"data/cross-sections/Organics (N-compounds)/Amines/C2H5NH2/C2H5NH2_Tannenbaum(1953)_298K_177,213nm(max).csv"
