T,author_year,download_url,comments,formula,name,citation,fname
298.0,Deters(1996),https://uv-vis-spectral-atlas-mainz.org//uvvis_data/cross_sections/Halogen%20oxides/Br%20oxides/Br2O_Deters(1996)_298K_208-444nm.txt,"Absorption measurements using a grating spectrograph, a photodiode array detector and a deuterium lamp as a light source (spectral resolution 0.46 nm)",Br2O,dibromine monoxide,"

  B. Deters, J.P. Burrows, S. Himmelmann, and C. Blindauer, ""Gas phase spectra of HOBr and Br",data/cross-sections/Halogen oxides/Br oxides/Br2O/Br2O_Deters(1996)_298K_208-444nm.csv
298.0,Deters(1996),"https://uv-vis-spectral-atlas-mainz.org//uvvis_data/cross_sections/Halogen%20oxides/Br%20oxides/Br2O_Deters(1996)_298K_315,350,390nm.txt","Absorption measurements using a grating spectrograph, a photodiode array detector and a deuterium lamp as a light source (spectral resolution 0.46 nm)",Br2O,dibromine monoxide,"

  B. Deters, J.P. Burrows, S. Himmelmann, and C. Blindauer, ""Gas phase spectra of HOBr and Br","data/cross-sections/Halogen oxides/Br oxides/Br2O/Br2O_Deters(1996)_298K_315,350,390nm.csv"
298.0,JPL-2010(2011),https://uv-vis-spectral-atlas-mainz.org//uvvis_data/cross_sections/Halogen%20oxides/Br%20oxides/Br2O_JPL-2010(2011)_298K_196-400nm(rec).txt,"JPL-2010 recommendation, adopting the earlier recommendation of ",Br2O,dibromine monoxide,"

  S.P. Sander, J. Abbatt, J. R. Barker, J. B. Burkholder, R. R. Friedl, D. M. Golden, R. E. Huie, C. E. Kolb, M. J. Kurylo, G. K. Moortgat, V. L. Orkin and P. H. Wine, ""Chemical Kinetics and Photochemical Data for Use in Atmospheric Studies, Evaluation Number 17"",
  JPL Publication 10-6, Jet Propulsion Laboratory, Pasadena, 2011; http://jpldataeval.jpl.nasa.gov/


",data/cross-sections/Halogen oxides/Br oxides/Br2O/Br2O_JPL-2010(2011)_298K_196-400nm(rec).csv
298.0,OrlandoBurkholder(1995),https://uv-vis-spectral-atlas-mainz.org//uvvis_data/cross_sections/Halogen%20oxides/Br%20oxides/Br2O_OrlandoBurkholder(1995)_298K_196-432nm(2nm).txt,Absorption measurements using a D,Br2O,dibromine monoxide,"

  J.J. Orlando and J.B. Burkholder, ""Gas phase UV/visble absorption spectra of HOBr and Br",data/cross-sections/Halogen oxides/Br oxides/Br2O/Br2O_OrlandoBurkholder(1995)_298K_196-432nm(2nm).csv
298.0,OrlandoBurkholder(1995),https://uv-vis-spectral-atlas-mainz.org//uvvis_data/cross_sections/Halogen%20oxides/Br%20oxides/Br2O_OrlandoBurkholder(1995)_298K_240-430nm(5nm).txt,Absorption measurements using a D,Br2O,dibromine monoxide,"

  J.J. Orlando and J.B. Burkholder, ""Gas phase UV/visble absorption spectra of HOBr and Br",data/cross-sections/Halogen oxides/Br oxides/Br2O/Br2O_OrlandoBurkholder(1995)_298K_240-430nm(5nm).csv
298.0,Rattigan(1996),https://uv-vis-spectral-atlas-mainz.org//uvvis_data/cross_sections/Halogen%20oxides/Br%20oxides/Br2O_Rattigan(1996)_298K_240-515nm.txt,Absorption measurements with a spectral resolution of 0.6 nm (FWHM) using a diode array spectrometer,Br2O,dibromine monoxide,"

  O.V. Rattigan, D.J. Lary, R.L. Jones, and R.A. Cox, ""UV-visible absorption cross sections of gaseous Br",data/cross-sections/Halogen oxides/Br oxides/Br2O/Br2O_Rattigan(1996)_298K_240-515nm.csv
