download_url,T2,λ2,author_year,comments,λ1,name,doi,formula,T1,fname
https://uv-vis-spectral-atlas-mainz.org//uvvis_data/cross_sections/Unclassified/Ga(CH3)3_Braun(1990)_303K_193.3nm.txt,NaN,NaN,Braun(1990),Absorption cross section at the ArF excimer laser line,193.3,"trimethylgallium, TMGa", https://doi.org/10.1016/0009-2614(90)85050-M,Ga(CH3)3,303.0,data/cross-sections/Unclassified/Ga(CH3)3/Ga(CH3)3_Braun(1990)_303K_193.csv
https://uv-vis-spectral-atlas-mainz.org//uvvis_data/cross_sections/Unclassified/Ga(CH3)3_Ibuki(1989)_298K_105-268nm.txt,NaN,268.0,Ibuki(1989),Absorption measurements using synchrotron radiation as a light source,105.0,"trimethylgallium, TMGa", https://doi.org/10.1016/0009-2614(89)87574-8,Ga(CH3)3,298.0,data/cross-sections/Unclassified/Ga(CH3)3/Ga(CH3)3_Ibuki(1989)_298K_105-268nm.csv
https://uv-vis-spectral-atlas-mainz.org//uvvis_data/cross_sections/Unclassified/Ga(CH3)3_McCraryDonnelly(1987)_298K_190-245nm.txt,NaN,245.0,McCraryDonnelly(1987),Optical densities OD at 298 K measured with a Beckman UV/Vis spectrophotometer and shown in Fig. 2 have been digitized and normalized to the peak absorption cross section σ(195.5nm) = 2.6×10,190.0,"trimethylgallium, TMGa", https://doi.org/10.1016/0022-0248(87)90139-4,Ga(CH3)3,298.0,data/cross-sections/Unclassified/Ga(CH3)3/Ga(CH3)3_McCraryDonnelly(1987)_298K_190-245nm.csv
https://uv-vis-spectral-atlas-mainz.org//uvvis_data/cross_sections/Unclassified/Ga(CH3)3_McCraryDonnelly(1987)_298K_193-257nm.txt,NaN,257.0,McCraryDonnelly(1987),"Absorption cross sections at the ArF, KrCl, and KrF excimer laser lines and at 257 nm",193.0,"trimethylgallium, TMGa", https://doi.org/10.1016/0022-0248(87)90139-4,Ga(CH3)3,298.0,data/cross-sections/Unclassified/Ga(CH3)3/Ga(CH3)3_McCraryDonnelly(1987)_298K_193-257nm.csv
https://uv-vis-spectral-atlas-mainz.org//uvvis_data/cross_sections/Unclassified/Ga(CH3)3_Okabe(1991)_299K_186-266nm.txt,NaN,266.0,Okabe(1991),The UV absorption spectrum was measured several times by a Cary 2390 (Varian) spectrophotometer with a bandwidth of 2 nm ,186.0,"trimethylgallium, TMGa", https://doi.org/10.1063/1.347219,Ga(CH3)3,299.0,data/cross-sections/Unclassified/Ga(CH3)3/Ga(CH3)3_Okabe(1991)_299K_186-266nm.csv
https://uv-vis-spectral-atlas-mainz.org//uvvis_data/cross_sections/Unclassified/Ga(CH3)3_Okabe(1991)_299K_193-248nm.txt,NaN,248.0,Okabe(1991),The UV absorption spectrum was measured several times with a Cary 2390 (Varian) spectrophotometer with a bandwidth of 2 nm ,193.0,"trimethylgallium, TMGa", https://doi.org/10.1063/1.347219,Ga(CH3)3,299.0,data/cross-sections/Unclassified/Ga(CH3)3/Ga(CH3)3_Okabe(1991)_299K_193-248nm.csv
https://uv-vis-spectral-atlas-mainz.org//uvvis_data/cross_sections/Unclassified/Ga(CH3)3_Okabe(1991)_393K_186-220nm.txt,NaN,220.0,Okabe(1991),The UV absorption spectrum was measured several times by a Cary 2390 (Varian) spectrophotometer with a bandwidth of 2 nm ,186.0,"trimethylgallium, TMGa", https://doi.org/10.1063/1.347219,Ga(CH3)3,393.0,data/cross-sections/Unclassified/Ga(CH3)3/Ga(CH3)3_Okabe(1991)_393K_186-220nm.csv
https://uv-vis-spectral-atlas-mainz.org//uvvis_data/cross_sections/Unclassified/Ga(CH3)3_Okabe(1991)_443K_186-267nm.txt,NaN,267.0,Okabe(1991),The UV absorption spectrum was measured several times by a Cary 2390 (Varian) spectrophotometer with a bandwidth of 2 nm ,186.0,"trimethylgallium, TMGa", https://doi.org/10.1063/1.347219,Ga(CH3)3,443.0,data/cross-sections/Unclassified/Ga(CH3)3/Ga(CH3)3_Okabe(1991)_443K_186-267nm.csv
