T,author_year,download_url,comments,formula,name,citation,fname
295.0,JPL-2010(2011),https://uv-vis-spectral-atlas-mainz.org//uvvis_data/cross_sections/Halogeno-alkanes+radicals/Bromoalkanes/CH2BrCH2Br_JPL-2010(2011)_295K_190-270nm(rec).txt,"JPL-2010 recommendation, adopting the earlier recommendations of",CH2BrCH2Br,"1,2-dibromoethane, ethylene dibromide","

  S.P. Sander, J. Abbatt, J. R. Barker, J. B. Burkholder, R. R. Friedl, D. M. Golden, R. E. Huie, C. E. Kolb, M. J. Kurylo, G. K. Moortgat, V. L. Orkin and P. H. Wine, ""Chemical Kinetics and Photochemical Data for Use in Atmospheric Studies, Evaluation Number 17"",
  JPL Publication 10-6, Jet Propulsion Laboratory, Pasadena, 2011; http://jpldataeval.jpl.nasa.gov/


",data/cross-sections/Halogeno-alkanes+radicals/Bromoalkanes/CH2BrCH2Br/CH2BrCH2Br_JPL-2010(2011)_295K_190-270nm(rec).csv
295.0,Uthman(1978),https://uv-vis-spectral-atlas-mainz.org//uvvis_data/cross_sections/Halogeno-alkanes+radicals/Bromoalkanes/CH2BrCH2Br_Uthman(1978)_295K_190-270nm.txt,"Absorption measurements were made using a double beam recording spectrophotometer with a deuterium arc source, a photomultiplier detector, and a prism dispersing device",CH2BrCH2Br,"1,2-dibromoethane, ethylene dibromide","

  A.P. Uthman, P.J. Demlein, T.D. Allston, M.C. Withiam, M.J. McClements, and G.A. Takacs, ""Photoabsorption spectra of gaseous methyl bromide, ethylene dibromide, nitrosyl bromide, thionyl chloride, and sulfuryl chloride"",
  J. Phys. Chem. 82, 2252-2257 (1978); 


  DOI: ",data/cross-sections/Halogeno-alkanes+radicals/Bromoalkanes/CH2BrCH2Br/CH2BrCH2Br_Uthman(1978)_295K_190-270nm.csv
