T,author_year,download_url,comments,formula,name,citation,fname
295.0,JPL-2010(2011),https://uv-vis-spectral-atlas-mainz.org//uvvis_data/cross_sections/Halogeno-alkenes+radicals/Fluoroalkenes/CH2=CHCF3_JPL-2010(2011)_295K_164-205nm(rec).txt,"JPL-2010 recommendation, adopting the earlier recommendation of ",CH2=CHCF3,"3,3,3-trifluoro-1-propene","

  S.P. Sander, J. Abbatt, J. R. Barker, J. B. Burkholder, R. R. Friedl, D. M. Golden, R. E. Huie, C. E. Kolb, M. J. Kurylo, G. K. Moortgat, V. L. Orkin and P. H. Wine, ""Chemical Kinetics and Photochemical Data for Use in Atmospheric Studies, Evaluation Number 17"",
  JPL Publication 10-6, Jet Propulsion Laboratory, Pasadena, 2011; http://jpldataeval.jpl.nasa.gov/


",data/cross-sections/Halogeno-alkenes+radicals/Fluoroalkenes/CH2=CHCF3/CH2=CHCF3_JPL-2010(2011)_295K_164-205nm(rec).csv
295.0,Orkin(1997),https://uv-vis-spectral-atlas-mainz.org//uvvis_data/cross_sections/Halogeno-alkenes+radicals/Fluoroalkenes/CH2=CHCF3_Orkin(1997)_295K_164-205nm.txt,The spectrum was recorded at increments of 0.5 nm at a spectral slit width of 0.5 nm,CH2=CHCF3,"3,3,3-trifluoro-1-propene","

  V.L. Orkin, R.E. Huie, and J. Kurylo, ""Rate constants for the reactions of OH with HFC-245cb (CH",data/cross-sections/Halogeno-alkenes+radicals/Fluoroalkenes/CH2=CHCF3/CH2=CHCF3_Orkin(1997)_295K_164-205nm.csv
