download_url,T2,λ2,author_year,comments,λ1,name,doi,formula,T1,fname
https://uv-vis-spectral-atlas-mainz.org//uvvis_data/cross_sections/Aromatic%20compounds/Heterocyclic/C5H5N_Bolovinos(1984)_298K_135.1-289.9nm.txt,NaN,289.9,Bolovinos(1984),"Absorption measurement using a Rank-Hilger 776 monochromator, a McPherson hydrogen light source, a dual-beam sample chamber, and a detection system (spectral resolution 0.25  nm)",135.1,pyridine, https://doi.org/10.1016/0022-2852(84)90051-1,C5H5N,298.0,data/cross-sections/Aromatic compounds/Heterocyclic/C5H5N/C5H5N_Bolovinos(1984)_298K_135.csv
https://uv-vis-spectral-atlas-mainz.org//uvvis_data/cross_sections/Aromatic%20compounds/Heterocyclic/C5H5N_Errami(2016)_353K_200-349nm(0.2nm).txt,NaN,349.0,Errami(2016),Absorption measurements using a D,200.0,pyridine, https://doi.org/10.1016/j.cplett.2016.09.030,C5H5N,353.0,data/cross-sections/Aromatic compounds/Heterocyclic/C5H5N/C5H5N_Errami(2016)_353K_200-349nm(0.csv
https://uv-vis-spectral-atlas-mainz.org//uvvis_data/cross_sections/Aromatic%20compounds/Heterocyclic/C5H5N_Errami(2016)_353K_200-349nm(1nm).txt,NaN,349.0,Errami(2016),Absorption measurements using a D,200.0,pyridine, https://doi.org/10.1016/j.cplett.2016.09.030,C5H5N,353.0,data/cross-sections/Aromatic compounds/Heterocyclic/C5H5N/C5H5N_Errami(2016)_353K_200-349nm(1nm).csv
https://uv-vis-spectral-atlas-mainz.org//uvvis_data/cross_sections/Aromatic%20compounds/Heterocyclic/C5H5N_Sousa(2019)_298K_57.7-131.9nm.txt,NaN,131.9,Sousa(2019),Absorption measurements using a double-ion chamber spectrometer and synchrotron radiation as  a light source; resolution 50 meV (0.70-1.25 nm),57.7,pyridine, https://doi.org/10.1021/acs.jpca.9b03778,C5H5N,298.0,data/cross-sections/Aromatic compounds/Heterocyclic/C5H5N/C5H5N_Sousa(2019)_298K_57.csv
"https://uv-vis-spectral-atlas-mainz.org//uvvis_data/cross_sections/Aromatic%20compounds/Heterocyclic/C5H5N_Tixier(2002)_298K_6.2-252.43nm(e,e).txt",NaN,252.43,Tixier(2002),"Measured by dipole (e,e) spectroscopy; energies E (in eV) and differential oscillator strengths df/dE (in 10",6.2,pyridine, https://doi.org/10.1016/S0368-2048(02)00019-1,C5H5N,298.0,data/cross-sections/Aromatic compounds/Heterocyclic/C5H5N/C5H5N_Tixier(2002)_298K_6.csv
