download_url,T2,λ2,author_year,comments,λ1,name,doi,formula,T1,fname
https://uv-vis-spectral-atlas-mainz.org//uvvis_data/cross_sections/Alkanes+alkyl%20radicals/Alkanes/c-C3H6_Basch(1969)_298K_108.9-170.9nm.txt,NaN,170.9,Basch(1969),Absorption measurements using a D,108.9,cyclopropane, https://doi.org/10.1063/1.1671770,c-C3H6,298.0,data/cross-sections/Alkanes+alkyl radicals/Alkanes/c-C3H6/c-C3H6_Basch(1969)_298K_108.csv
https://uv-vis-spectral-atlas-mainz.org//uvvis_data/cross_sections/Alkanes+alkyl%20radicals/Alkanes/c-C3H6_Bragg(1985)_298K_710.43nm.txt,NaN,NaN,Bragg(1985),Absorption measurements using a multipass absorption cell and a Fourier transform spectrometer,710.43,cyclopropane, https://doi.org/10.1364/OL.10.000321,c-C3H6,298.0,data/cross-sections/Alkanes+alkyl radicals/Alkanes/c-C3H6/c-C3H6_Bragg(1985)_298K_710.csv
https://uv-vis-spectral-atlas-mainz.org//uvvis_data/cross_sections/Alkanes+alkyl%20radicals/Alkanes/c-C3H6_Currie(1963)_298K_147nm.txt,NaN,NaN,Currie(1963),"The absorption coefficient k (atm, 298 K)",147.0,cyclopropane, https://doi.org/10.1021/j100801a022,c-C3H6,298.0,data/cross-sections/Alkanes+alkyl radicals/Alkanes/c-C3H6/c-C3H6_Currie(1963)_298K_147nm.csv
https://uv-vis-spectral-atlas-mainz.org//uvvis_data/cross_sections/Alkanes+alkyl%20radicals/Alkanes/c-C3H6_Gingell(1999)_298K_109.8-177.1nm(opt).txt,NaN,177.1,Gingell(1999),The absorption spectrum has been measured at steps of 0.05nm using monochromated synchroton radiation,109.8,cyclopropane, https://doi.org/10.1088/0953-4075/32/11/319,c-C3H6,298.0,data/cross-sections/Alkanes+alkyl radicals/Alkanes/c-C3H6/c-C3H6_Gingell(1999)_298K_109.csv
https://uv-vis-spectral-atlas-mainz.org//uvvis_data/cross_sections/Alkanes+alkyl%20radicals/Alkanes/c-C3H6_Gingell(1999)_298K_31.1-177.3nm(opt+EEL).txt,NaN,177.3,Gingell(1999),A best-estimate cross section curve constructed by combination of optical and EEL measurements is shown in Fig. 8,31.1,cyclopropane, https://doi.org/10.1088/0953-4075/32/11/319,c-C3H6,298.0,data/cross-sections/Alkanes+alkyl radicals/Alkanes/c-C3H6/c-C3H6_Gingell(1999)_298K_31.csv
https://uv-vis-spectral-atlas-mainz.org//uvvis_data/cross_sections/Alkanes+alkyl%20radicals/Alkanes/c-C3H6_Gingell(1999)_298K_31.8-156.9nm(opt).txt,NaN,156.9,Gingell(1999),The absorption spectrum has been measured at steps of 0.05nm using monochromated synchroton radiation,31.8,cyclopropane, https://doi.org/10.1088/0953-4075/32/11/319,c-C3H6,298.0,data/cross-sections/Alkanes+alkyl radicals/Alkanes/c-C3H6/c-C3H6_Gingell(1999)_298K_31.csv
https://uv-vis-spectral-atlas-mainz.org//uvvis_data/cross_sections/Alkanes+alkyl%20radicals/Alkanes/c-C3H6_Gingell(1999)_298K_94-157nm(EEL).txt,NaN,157.0,Gingell(1999),High-resolution electron energy loss spectroscopy (EEL),94.0,cyclopropane, https://doi.org/10.1088/0953-4075/32/11/319,c-C3H6,298.0,data/cross-sections/Alkanes+alkyl radicals/Alkanes/c-C3H6/c-C3H6_Gingell(1999)_298K_94-157nm(EEL).csv
https://uv-vis-spectral-atlas-mainz.org//uvvis_data/cross_sections/Alkanes+alkyl%20radicals/Alkanes/c-C3H6_Kameta(1999)_298K_50.8-129.6nm.txt,NaN,129.6,Kameta(1999),"Absorption measurements using a double ionization chamber and synchrotron radiation as a continuous-wavelength light source; wavelength scan-step of 0.02 nm
",50.8,cyclopropane, https://doi.org/10.1088/0953-4075/32/11/318,c-C3H6,298.0,data/cross-sections/Alkanes+alkyl radicals/Alkanes/c-C3H6/c-C3H6_Kameta(1999)_298K_50.csv
https://uv-vis-spectral-atlas-mainz.org//uvvis_data/cross_sections/Alkanes+alkyl%20radicals/Alkanes/c-C3H6_Koizumi(1985)_298K_33.5-123.2nm.txt,NaN,123.2,Koizumi(1985),High-resolution (~0.08 nm) absorption measurements using synchrotron radiation and an ionization chamber,33.5,cyclopropane, https://doi.org/10.1063/1.448655,c-C3H6,298.0,data/cross-sections/Alkanes+alkyl radicals/Alkanes/c-C3H6/c-C3H6_Koizumi(1985)_298K_33.csv
https://uv-vis-spectral-atlas-mainz.org//uvvis_data/cross_sections/Alkanes+alkyl%20radicals/Alkanes/c-C3H6_RaymondaSimpson(1967)_298K_107.6-173.5nm.txt,NaN,173.5,RaymondaSimpson(1967),"Normal-incidence grating vacuum spectrograph, a Lyman intermittent spark as a light source, photographic plates, and a microdensitometer",107.6,cyclopropane, https://doi.org/10.1063/1.1711913,c-C3H6,298.0,data/cross-sections/Alkanes+alkyl radicals/Alkanes/c-C3H6/c-C3H6_RaymondaSimpson(1967)_298K_107.csv
https://uv-vis-spectral-atlas-mainz.org//uvvis_data/cross_sections/Alkanes+alkyl%20radicals/Alkanes/c-C3H6_Schoen(1962)_295K_45.9-137.7nm(smoo).txt,NaN,137.7,Schoen(1962),"High-voltage sparks as a light source, vacuum monochromator and grating; spectral resolution 0.8 nm",45.9,cyclopropane, https://doi.org/10.1063/1.1733423,c-C3H6,295.0,data/cross-sections/Alkanes+alkyl radicals/Alkanes/c-C3H6/c-C3H6_Schoen(1962)_295K_45.csv
https://uv-vis-spectral-atlas-mainz.org//uvvis_data/cross_sections/Alkanes+alkyl%20radicals/Alkanes/c-C3H6_Schoen(1962)_295K_46.3-137.6nm(meas).txt,NaN,137.6,Schoen(1962),"High-voltage sparks as a light source, vacuum monochromator and grating; spectral resolution 0.8 nm",46.3,cyclopropane, https://doi.org/10.1063/1.1733423,c-C3H6,295.0,data/cross-sections/Alkanes+alkyl radicals/Alkanes/c-C3H6/c-C3H6_Schoen(1962)_295K_46.csv
https://uv-vis-spectral-atlas-mainz.org//uvvis_data/cross_sections/Alkanes+alkyl%20radicals/Alkanes/c-C3H6_SzeBrion(1991)_298K_56.4-157nm(EEL).txt,NaN,157.0,SzeBrion(1991),High-resolution electron energy loss spectroscopy (EEL),56.4,cyclopropane, https://doi.org/10.1016/0368-2048(91)85019-P,c-C3H6,298.0,data/cross-sections/Alkanes+alkyl radicals/Alkanes/c-C3H6/c-C3H6_SzeBrion(1991)_298K_56.csv
https://uv-vis-spectral-atlas-mainz.org//uvvis_data/cross_sections/Alkanes+alkyl%20radicals/Alkanes/c-C3H6_Walker(2007)_298K_42.25-179.98nm.txt,NaN,179.98,Walker(2007),The absorption spectrum has been measured using monochromated synchroton radiation at a resolution of 0.1 nm,42.25,cyclopropane, https://doi.org/10.1088/0953-4075/40/10/021,c-C3H6,298.0,data/cross-sections/Alkanes+alkyl radicals/Alkanes/c-C3H6/c-C3H6_Walker(2007)_298K_42.csv
https://uv-vis-spectral-atlas-mainz.org//uvvis_data/cross_sections/Alkanes+alkyl%20radicals/Alkanes/c-C3H6_Walker(2007)_298K_42.8-156.9nm.txt,NaN,156.9,Walker(2007),The absorption spectrum has been measured using monochromated synchroton radiation at a resolution of 0.1 nm,42.8,cyclopropane, https://doi.org/10.1088/0953-4075/40/10/021,c-C3H6,298.0,data/cross-sections/Alkanes+alkyl radicals/Alkanes/c-C3H6/c-C3H6_Walker(2007)_298K_42.csv
